,link,rating,date,source,review_id,snippet,likes,user.name,user.link,user.contributor_id,user.thumbnail,user.reviews,extracted_snippet.original,extracted_snippet.translated,response.date,response.snippet,response.extracted_snippet.original,response.extracted_snippet.translated,user.local_guide,user.photos,details.nota_editada
8,https://www.google.com/maps/reviews/data=!4m8!14m7!1m6!2m5!1sChZDSUhNMG9nS0VJQ0FnSURaeGRydUJBEAE!2m1!1s0x0:0x9927a6abdc88509a!3m1!1s2@1:CIHM0ogKEICAgIDZxdruBA%7CCgsI3PzpqQYQgOCNbg%7C?hl=en-US,1.0,4 months ago,Google,ChZDSUhNMG9nS0VJQ0FnSURaeGRydUJBEAE,"Contraté la operación/tratamiento de Microespuma para hemorroides, haciéndome todas las pruebas que me pidieron para saber si era apto para esta operación, electrocardiograma, colonoscopia....y me dijeron que si. Me dieron 3 sesiones y el problema que tenía de sangrado no se me ha solucionado y me contestan que no me pueden dar más sesiones ni devolverme el dinero que pagué porque me han dado las 3 sesiones que se incluye en el precio, cuando los médicos cirujanos me dijeron que con este tratamiento iba a solucionar mi problema, porque si me llegan a decir que no es seguro que me sea efectivo no lo pago.
Aparte las pruebas COVID que tuve que hacerme en en Hospital antes de la intervención no están incluidas en el precio ni las consultas telefónicas de después con el cirujano para saber como te encuentras. Me siento estafado y engañado.

NOTA EDITADA: A fecha 26 de Octubre me contestan del departamento de reclamaciones y me contestan que el tratamiento no es eficaz al 100%, que yo contraté 3 sesiones y me negué a hacerme pruebas diagnósticas. Son unos impresentables y mentirosos, yo nunca me he negado a hacerme ninguna prueba porque no me ofrecieron nada, solo decirme que como me dieron 3 sesiones no me devuelven el dinero.
Qué el personal médico mienta de esa manera me parece que es que no tienen vergüenza ni la conocen. Dinero perdido...",1.0,Julian Martinez Rojo,https://www.google.com/maps/contrib/104645254718665820375?hl=en-US,104645254718665820375,https://lh3.googleusercontent.com/a/ACg8ocIc1-Td5TIKsivOgjGU7JSG6qaELnzDLsKJPUdpxla3=s40-c-rp-mo-br100,5,"Contraté la operación/tratamiento de Microespuma para hemorroides, haciéndome todas las pruebas que me pidieron para saber si era apto para esta operación, electrocardiograma, colonoscopia....y me dijeron que si. Me dieron 3 sesiones y el problema que tenía de sangrado no se me ha solucionado y me contestan que no me pueden dar más sesiones ni devolverme el dinero que pagué porque me han dado las 3 sesiones que se incluye en el precio, cuando los médicos cirujanos me dijeron que con este tratamiento iba a solucionar mi problema, porque si me llegan a decir que no es seguro que me sea efectivo no lo pago.
Aparte las pruebas COVID que tuve que hacerme en en Hospital antes de la intervención no están incluidas en el precio ni las consultas telefónicas de después con el cirujano para saber como te encuentras. Me siento estafado y engañado.

NOTA EDITADA: A fecha 26 de Octubre me contestan del departamento de reclamaciones y me contestan que el tratamiento no es eficaz al 100%, que yo contraté 3 sesiones y me negué a hacerme pruebas diagnósticas. Son unos impresentables y mentirosos, yo nunca me he negado a hacerme ninguna prueba porque no me ofrecieron nada, solo decirme que como me dieron 3 sesiones no me devuelven el dinero.
Qué el personal médico mienta de esa manera me parece que es que no tienen vergüenza ni la conocen. Dinero perdido...","I contracted the Microfoam operation/treatment for hemorrhoids, doing all the tests they asked me to see if I was suitable for this operation, electrocardiogram, colonoscopy... and they told me yes. They gave me 3 sessions and the bleeding problem I had has not been solved and they answered that they cannot give me more sessions or return the money I paid because they have given me the 3 sessions that are included in the price, when the surgeons They told me that this treatment would solve my problem, because if they tell me that it is not certain that it will be effective, I will not pay for it.
Apart from that, the COVID tests that I had to do at the hospital before the intervention are not included in the price, nor are the telephone consultations afterwards with the surgeon to find out how you are feeling. I feel cheated and deceived.

EDITED NOTE: As of October 26, the claims department responded to me and told me that the treatment is not 100% effective, that I booked 3 sessions and refused to undergo diagnostic tests. They are unpresentable and liars, I have never refused to have any tests done because they didn't offer me anything, they just told me that since they gave me 3 sessions they won't give me my money back.
It seems to me that the medical staff lies that way because they have no shame nor do they know it. Lost money...",4 months ago,"Queremos mejorar siempre. Por favor, si lo deseas, puedes escribirnos a en teescuchamos-zarzuela@sanitas.es con tus datos y así conocer la situación de primera mano. Muchas gracias. [+info. sobre como tratamos tus datos personales en www.sanitas.es/gdpr]","Queremos mejorar siempre. Por favor, si lo deseas, puedes escribirnos a en teescuchamos-zarzuela@sanitas.es con tus datos y así conocer la situación de primera mano. Muchas gracias. [+info. sobre como tratamos tus datos personales en www.sanitas.es/gdpr]","We always want to improve. Please, if you wish, you can write to us at teescuchamos-zarzuela@sanitas.es with your information and thus know the situation first-hand. Thank you so much. [+info. about how we treat your personal data at www.sanitas.es/gdpr]",,,"A fecha 26 de Octubre me contestan del departamento de reclamaciones y me contestan que el tratamiento no es eficaz al 100%, que yo contraté 3 sesiones y me negué a hacerme pruebas diagnósticas. Son unos impresentables y mentirosos, yo nunca me he negado a hacerme ninguna prueba porque no me ofrecieron nada, solo decirme que como me dieron 3 sesiones no me devuelven el dinero."
9,https://www.google.com/maps/reviews/data=!4m8!14m7!1m6!2m5!1sChZDSUhNMG9nS0VJQ0FnSUNaXzlmU1B3EAE!2m1!1s0x0:0x9927a6abdc88509a!3m1!1s2@1:CIHM0ogKEICAgICZ_9fSPw%7CCgsIuqrlqQYQyI6MWQ%7C?hl=en-US,5.0,4 months ago,Google,ChZDSUhNMG9nS0VJQ0FnSUNaXzlmU1B3EAE,"He acudido a este Hospital por una cuestión muy importante y delicada para mi y me he encontrado con unos profesionales extraordinarios, tanto en Radiodiagnostico (Dra. Sofia, Anton y Yania), Recepción de  Radiodiagnostico (Srta. Feli) y Ginecología (Dr.Torres) que han demostrado una calidad humana y una profesionalidad fuera de lo comun. Muchas gracias!!!!",1.0,Violeta Lario,https://www.google.com/maps/contrib/102231717005537662128?hl=en-US,102231717005537662128,https://lh3.googleusercontent.com/a/ACg8ocJvnYf4Muo9ev3iKtObefk7gpzBNwzti8N7K1o1yDgt=s40-c-rp-mo-br100,107,"He acudido a este Hospital por una cuestión muy importante y delicada para mi y me he encontrado con unos profesionales extraordinarios, tanto en Radiodiagnostico (Dra. Sofia, Anton y Yania), Recepción de  Radiodiagnostico (Srta. Feli) y Ginecología (Dr.Torres) que han demostrado una calidad humana y una profesionalidad fuera de lo comun. Muchas gracias!!!!","I have gone to this Hospital for a very important and delicate matter for me and I have met some extraordinary professionals, both in Radiodiagnostics (Dr. Sofia, Anton and Yania), Radiodiagnostic Reception (Ms. Feli) and Gynecology (Dr. Torres ) who have demonstrated unusual human quality and professionalism. Thank you so much!!!!",5 months ago,"Hola Violeta,
Gracias por dedicarnos tiempo y comunicarnos tu opinión. Trasmitiremos tus comentarios al equipo :)
Que tengas un buen día.","Hola Violeta,
Gracias por dedicarnos tiempo y comunicarnos tu opinión. Trasmitiremos tus comentarios al equipo :)
Que tengas un buen día.","Hi Violeta,
Thank you for taking the time and letting us know your opinion. We will pass on your comments to the team :)
Have a good day.",,11.0,
